[
  {
    "name": "Afghanistan",
    "slug": "afghanistan",
    "flag": "ðŸ‡¦ðŸ‡«",
    "description": "Economic pressure & gender apartheid",
    "seoDescription": "Afghanistan faces severe humanitarian crisis under Taliban rule: economic collapse, gender apartheid, and over two decades of foreign occupation.",
    "category": "Invasion & Occupation"
  },
  {
    "name": "Democratic Republic of the Congo",
    "slug": "drc",
    "flag": "ðŸ‡¨ðŸ‡©",
    "description": "Conflict over strategic minerals",
    "seoDescription": "DRC's endless war over strategic minerals has displaced millions. Discover the colonial legacy, foreign exploitation, and path to lasting peace.",
    "category": "Insurgency & Resource Conflict"
  },
  {
    "name": "Haiti",
    "slug": "haiti",
    "flag": "ðŸ‡­ðŸ‡¹",
    "description": "State collapse & foreign debt",
    "seoDescription": "Haiti's state collapse and crushing foreign debt create widespread chaos. Learn about the 200-year struggle for sovereignty and international responsibility.",
    "category": "State Collapse & Civil War"
  },
  {
    "name": "Myanmar",
    "slug": "myanmar",
    "flag": "ðŸ‡²ðŸ‡²",
    "description": "Uprising against military rule",
    "seoDescription": "Myanmar's military junta faces massive popular uprising after 2021 coup. Explore ethnic conflicts, Rohingya crisis, and path to democratic transition.",
    "category": "State Collapse & Civil War"
  },
  {
    "name": "Palestine",
    "slug": "palestine",
    "flag": "ðŸ‡µðŸ‡¸",
    "description": "Genocide, apartheid & settler colonialism",
    "seoDescription": "Palestine's intensifying humanitarian catastrophe: genocide in Gaza, apartheid system, and 75 years of dispossession. Critical analysis of settler colonialism.",
    "category": "Occupation & Dispossession"
  },
  {
    "name": "Sahel",
    "slug": "sahel",
    "flag": "ðŸ‡§ðŸ‡«ðŸ‡²ðŸ‡±ðŸ‡³ðŸ‡ª",
    "description": "Regional insurgency & climate change",
    "seoDescription": "The Sahel region's deadly jihadist insurgency compounds the climate crisis. Armed groups, foreign military interventions, and the fight for regional stability.",
    "category": "Insurgency & Resource Conflict"
  },
  {
    "name": "Somalia",
    "slug": "somalia",
    "flag": "ðŸ‡¸ðŸ‡´",
    "description": "State collapse & historical divisions",
    "seoDescription": "Somalia's 30-year state collapse: al-Shabaab insurgency, climate disasters, and artificial colonial borders. Understanding famine and foreign interventions.",
    "category": "State Collapse & Civil War"
  },
  {
    "name": "South Sudan",
    "slug": "south-sudan",
    "flag": "ðŸ‡¸ðŸ‡¸",
    "description": "Conflict over control of oil revenues",
    "seoDescription": "South Sudan's oil-fuelled civil war has displaced millions. The world's newest nation struggles with corruption, ethnic violence, and fragile peace agreements.",
    "category": "Insurgency & Resource Conflict"
  },
  {
    "name": "Sudan",
    "slug": "sudan",
    "flag": "ðŸ‡¸ðŸ‡©",
    "description": "War between rival military factions",
    "seoDescription": "Sudan's military factions battle for power following the 2021 coup. Mass displacement, economic collapse, and the struggle for democratic transition.",
    "category": "State Collapse & Civil War"
  },
  {
    "name": "Yemen",
    "slug": "yemen",
    "flag": "ðŸ‡¾ðŸ‡ª",
    "description": "Conflict over a strategic trade route",
    "seoDescription": "Yemen's proxy war over Red Sea trade routes creates the world's worst humanitarian crisis. Saudi-UAE intervention and Houthi resistance since 2015.",
    "category": "State Collapse & Civil War"
  }
]
